Call_ID,Transcript,Extracted_Event,Location,Sentiment,Urgency_Score
C666,Is there a report of somebody shooting? I don't know where. Do you know if anybody's heard right now? Yeah.,Assault,Unknown,Distressed,0.7
C667,Where's your emergency? There's a gunshot. We're at. Gunshot in 1600. 1600.,Assault,Unknown,Distressed,0.9
C668,"Who are at our house and told us to break into our house? Okay, where's your mom at? She got-",Unknown,Unknown,Distressed,0.0
C669,Hello sir. Yeah. Did you dial 911 a little while ago?,Unknown,Unknown,Distressed,0.0
C670,The shoot over in the main center. That's why you serve. I'm in the building.,Unknown,Unknown,Calm,0.0
C671,There are bees like hundreds swarming around a guy who can't get up off the ground thousand.,Unknown,Unknown,Distressed,0.0
C672,20 feet underwater. There! We need to get out here! Out of here! 9-1!,Unknown,Unknown,Distressed,0.2
C673,And so we get fit What is that? Vyremal What kind of animal is that?,Unknown,Unknown,Distressed,0.0
C674,"I didn't mean it's gonna be right down. Alright, we will ask her this.",Unknown,Unknown,Calm,0.0
C675,One of the kids was at the first holiday on the day and I don't know if she's okay enough.,Unknown,Unknown,Distressed,0.3
C676,"The fight, man, it's smoking out, man. You think Green Park and Dogwood?",Assault,"Dogwood, Green Park",Distressed,0.2
C677,She's not waking up. Okay. What's her address?,Unknown,Unknown,Distressed,0.0
C678,"Case it, fámbia a- ス ff e ao o o o sorry, there, a peiser",Unknown,Unknown,Distressed,0.0
C679,"I just shot the Mormons Bishop over here until they're here. You did? Yes, it is. Your name?",Assault,Unknown,Distressed,0.3
C680,And this guy has a gun in my hat. I need the cloth. The God's got a gun in my hand. 17.,Assault,Unknown,Distressed,0.3
C681,So like at least four or five people start at the end. That's where?,Unknown,Unknown,Distressed,0.0
C682,"I'm going to start with the exact same rules. By a loose, okay? And if he conscious and breathing,",Unknown,Unknown,Distressed,0.0
C683,"Yeah, we just, I need to report a kidnapping. We're kidnapping, what happened? A guy in a...",Theft,Unknown,Distressed,0.1
C684,"Hi, I called a little while ago and believe I talked to Stacy. My...",Unknown,Unknown,Calm,0.0
C685,emergency.,Unknown,Unknown,Distressed,0.3
C686,"Yes, ma'am. I need somebody to come to Penicry, Glendon. Okay.",Unknown,Glendon,Calm,0.0
C687,My name is Mary Lyons. I'm the Banking Center Manager at Bank of America at 185 Highland,Unknown,Bank,Calm,0.0
C688,"You mean some reason to ask her on my mom? Yeah, I don't even, she just called.",Unknown,Unknown,Distressed,0.0
C689,This is the hospital. Where am I at? On that dog's office. They're shooting in the hallway around the eighth floor of their shooter.,Assault,Unknown,Distressed,0.3
C690,The old North Shore Road and my husband's been attacked by a bear.,Assault,North Shore Road,Distressed,0.0
C691,"Somebody somebody's full of them is our shoe and they're not shot by two pieces. Okay, we're getting some up up.",Assault,Unknown,Distressed,0.3
C692,"Oh my god, the fire! So now, it's the level where I'm inside.",Fire,Unknown,Distressed,0.65
C693,"on 23rd grade. This is Tony Guzman, I'm a staffer and he was overheaded towards.",Unknown,Unknown,Calm,0.0
C694,"high, a little airplane, a little one-engine airplane took off from the airport at 83rd Street in Christ.",Accident,"83rd Street, Christ",Distressed,0.0
C695,"I'm sorry. Good outdoor. Good things. Yes, ma'am. Yes, ma'am.",Unknown,Unknown,Calm,0.0
C696,Hello. Is everything okay? Ah.,Unknown,Unknown,Calm,0.0
C697,"Okay, what do you need to believe?",Unknown,Unknown,Calm,0.0
C698,"Yes, I need the police please, as my house. Glad to. I think we need an ambulance.",Medical,Unknown,Distressed,0.3
C699,Okay. We need a person back in the meat department to get an in.,Unknown,Unknown,Distressed,0.0
C700,What do you need? You need the police?,Unknown,Unknown,Distressed,0.0
C701,"Somebody go into my house. Where the hell is that? What's your address? Yeah, but...",Unknown,Unknown,Distressed,0.0
C702,"We just got a lot to come upon. It's gonna come here with a gun, shot one of our employees, and uh...",Assault,Unknown,Distressed,0.6
C703,Now that is vac and sample the floor. So that is Please check it out! And on those,Unknown,Unknown,Calm,0.65
C704,"Oh, my mind's at the doctor. You're not at the doctor. Are you there alone?",Unknown,Unknown,Distressed,0.0
C705,I'm attracted to companies. I'm no different choice. Right I am.,Unknown,Unknown,Calm,0.0
C706,"Oh, there's a student. Who's been shot, man?",Assault,Unknown,Distressed,0.3
C707,"Yes, I need a police officer over here. What's going on? Um...",Unknown,Unknown,Distressed,0.0
