Call_ID,Transcript,Extracted_Event,Location,Sentiment,Urgency_Score
C443,My ass bloopers is staring at the hell out of me It's stopping in my head and my neck and my...,Unknown,Unknown,Distressed,0.0
C444,"My partner's on fire, he can't. Err! Okay, stay on the line with me, don't hang out. No, please!",Fire,Unknown,Distressed,0.7
C445,I don't want Marge and Martin to stay. Help! It's a guy's coming! I can take him and go!,Unknown,Unknown,Calm,0.45
C446,"I think he had a parachute on him, a guy parachute.",Unknown,Unknown,Distressed,0.0
C447,"What's the problem there? There's a fire on pregnant. There's a fire at home? Yes, please come. OK, get outside.",Fire,Unknown,Distressed,0.65
C448,Why would the pan cut me? I need assistance right away. What happened? My wife has now,Unknown,Unknown,Distressed,0.3
C449,I have a concern for a co-worker. She just called me and sounded very...,Unknown,Unknown,Distressed,0.1
C450,"A white female passenger pass out on one of our vehicles, which is 21-22.",Accident,Unknown,Distressed,0.0
C451,"Hello, um, he's going down to the black way with my baby. Okay, where are you?",Unknown,Unknown,Calm,0.0
C452,I'm going to turn this to the 258 from here. I'm going to turn the 258 from here.,Unknown,Unknown,Distressed,0.0
C453,"I don't know. There's a lady laying out here on the side wall. Okay, bleeding. Okay. Are you with the lady?",Medical,Unknown,Distressed,0.6
C454,"Hi, my name is Jean Thomas. I'm watching my home on live monitor and there's a black man in my house and he's robbing it.",Theft,Unknown,Distressed,0.0
C455,"I'm going to start giving him out the lobby for any black. Miss, yes, General, I know it's where you with him now.",Unknown,Unknown,Distressed,0.3
C456,There is a strange man outside our home and he hollered.,Unknown,Unknown,Distressed,0.0
C458,My wife says in the bathroom she is bleeding all over the place. She thinks she's having a...,Medical,Unknown,Distressed,0.3
C459,"and since May 8th, we've just got robbed. Okay, what they look like.",Theft,Unknown,Calm,0.0
C460,We've got a person here who is not fit to drive and needs to be taken to that system.,Unknown,Unknown,Distressed,0.0
C461,"because I'm the lady, I'm my teenage lady, she was yelling for help, and they looked like she had a blood all over her.",Disturbance,Unknown,Distressed,0.3
C462,"There's somebody killed someone. Okay, ask for where the suspect is.",Assault,Unknown,Distressed,0.4
C463,NIL Japan Yeah we're Sign,Unknown,Japan,Calm,0.05
C464,The man is withhelped by fire.,Fire,Unknown,Distressed,0.6
C465,I need an ambulance for two hours. Somebody just come and collect you up. What a drug.,Medical,Unknown,Distressed,0.0
C466,units know that it is confirmed rotation on the ground. Just want to roll our house off for five. Bring clean.,Unknown,Unknown,Distressed,0.3
C467,way into the north I've seen a funnel cloud just reporting my first optimally or residing garbage,Unknown,Unknown,Distressed,0.1
C468,We just got in the tornado and the car slipped and the windows mercy and we're bleeding.,Accident,Unknown,Distressed,0.3
C469,I told you this came across there say 24 okay. Yeah,Unknown,Unknown,Calm,0.0
C470,"Yeah, I have a rotating cloud coming in a southwest of Regis, Yeah.",Unknown,Unknown,Calm,0.0
C471,"Yes, it looks like we're gonna touch down on broad moral. Are you hard car? No, I'm looking at",Accident,Unknown,Calm,0.0
C472,"No, ma'am, we can see a tornado. We're at 914, Hillcrest. We have about five of us all.",Unknown,Hillcrest,Calm,0.0
C473,"My mom, she's sick and she can't wait to see you. She can't wait, God.",Unknown,Unknown,Calm,0.0
C474,I'm so glad we need the wheels to the car. She ran over three people in a row. Where? I'm so glad we're here again.,Accident,Unknown,Calm,0.0
C475,Where is the guy with the gun in the case he's with Ames? Which case is the Lincoln Y1?,Assault,Unknown,Distressed,0.35
C476,I'm just kidding the sounds of it. You can hear it in. Who is that? That's the course to be in that style.,Unknown,Unknown,Concerned,0.0
C478,"My phone is on my phone. Okay, 615. It's okay.",Unknown,Unknown,Calm,0.0
C479,"and then warrant. There's a fire back here at someone's front porch. Okay, where you need the fire department, ma'am?",Fire,Unknown,Distressed,0.4
C480,We just saw a big airliner just being coated by two five planes.,Accident,Unknown,Distressed,0.0
C481,So we'll only get reviltrared. OK. Thank you. Keep going until the second round.,Unknown,Unknown,Calm,0.05
C482,emergency. Oh that's the F18 chasing a big commercial plane around and around all those downtown,Accident,Unknown,Distressed,0.35
C483,"Yeah, I had two unusual aircraft fly really close.",Unknown,Unknown,Calm,0.0
C484,I'm the designer of the house and I'm really just a robber. What are your address? My name is...,Unknown,Unknown,Distressed,0.0
C485,by the river the dog jumped in the water and we can't get out. Oh my god!,Unknown,Unknown,Distressed,0.05
C486,"Just let me just walk up and then we'll settle down and drop. Okay, sir, stay with me, okay?",Unknown,Unknown,Calm,0.0
C487,"If not, I'm calling from the Sheraton Baltimore North. Yes sir. We have a dead body in one of our rooms.",Assault,Baltimore,Distressed,0.3
C488,because they just jumped my 13 year old daughter and it's about to be all hell for a glimmer on.,Unknown,Unknown,Distressed,0.0
C489,We got off for damn. What do you mean you have an off? We don't have a whole bunch of officers down.,Unknown,Unknown,Distressed,0.0
C490,"Bu дядр,W war",Unknown,Unknown,Distressed,0.0
C491,"You know, Lyleview's shut down. You heard what? I seen a Lyleview's quiet down.",Unknown,Unknown,Distressed,0.3
C492,It's too late. And the high winds have the...,Unknown,Unknown,Distressed,0.0
C493,"We had a dead body right out in front of our school in the grass area, but we're at the John Fee door to be John's in location.",Assault,the John Fee,Distressed,0.3
C495,"If the address is 1160 Ray Road, we have a baby missing out of a crib.",Unknown,Unknown,Distressed,0.2
C496,I just called over to my sister's house and I have a phone.,Unknown,Unknown,Distressed,0.0
C497,The phone man following me from the application. Damn. Did he show the gun to you?,Assault,Unknown,Distressed,0.3
C498,Somebody just came in and shot my daughter and my husband. They shot them? They shot them? What's your act?,Assault,Unknown,Distressed,0.3
C499,I'm watching TV and I heard five shots and there's someone laying in my front yard. A woman's sitter.,Assault,Unknown,Distressed,0.45
C500,I just killed my family. What's the knife? All of them. All for real. What's your name? Michael Miller.,Assault,Unknown,Distressed,0.6
C501,MY CAMBE! SCREWT but is he going to steal her? Where are you? I don't know how to tell your mama...,Unknown,Unknown,Distressed,0.5
C502,I'm not going to be a police fire ambulance. I need to be a police comm. I'm a brother strong and he took out a knife. Police.,Fire,Unknown,Distressed,0.6
C503,I'm pulled over in the road. My husband's in the middle of the road having a serious like psych...,Unknown,Unknown,Distressed,0.0
C504,"Well, my husband's not, I cannot seem to wake him up.",Unknown,Unknown,Distressed,0.0
C505,"Now listen here. I've got two people here help hospital, right? Okay. Now you know what?",Unknown,Unknown,Distressed,0.6
C506,see. Bargur was breaking into a house next door. What's the address there sir? 74.,Theft,Unknown,Distressed,0.0
C507,"Our state, we have a Burmese python, it's about 12 foot long, she got out of the cage last night and got into...",Unknown,Unknown,Concerned,0.0
C508,"We were just said and talking my wife, you know Bob, and then she fell on the floor. Okay, what?",Unknown,Unknown,Distressed,0.3
C509,"I don't want to go. Hey, just before I made a street up here by Wild Rock chasing us. Where are you at?",Unknown,Wild Rock,Distressed,0.0
C510,It's a must've been shot. I haven't picked the vitals.,Assault,Unknown,Distressed,0.3
C511,There's a guy there with a gun. Yeah. Black and white. Black and white.,Accident,Unknown,Distressed,0.3
C512,I'm glad to have some guys walking around the parking lot. Welcome to some great garden. He's a big person. Tell me the address please.,Unknown,Unknown,Calm,0.3
C513,"Yeah, the man on the phone says there's a man on his property with a gun. Okay, and that's where the person is supposed to be too.",Assault,Unknown,Distressed,0.3
C514,I just been bitten by a red tail fox up in Red Reef Park.,Unknown,Red Reef Park,Distressed,0.0
C515,"Yes. We had a, I think, a shooting right now on the bus barn on the high school.",Assault,Unknown,Distressed,0.6
C516,"out, not working. Not working. My babies are in there. Oh my God, I'm moved here.",Unknown,Unknown,Distressed,0.0
C517,Somebody just came in and shot my daughter and my husband. They shot them. Please send me a check. I love my girl.,Assault,Unknown,Distressed,0.6
C518,is not breathing. Okay. Is there any way you can,Medical,Unknown,Distressed,0.3
C519,What do I think? I think I need an ambulance. I've got a teenager who's turning purple in his face. I think he's soaked out or something.,Medical,Unknown,Distressed,0.0
C520,"Yeah, there's been a bunch of guns out to my house. I think a bunch of people were shot. We're at 2112 views.",Assault,Unknown,Distressed,0.6
C521,"estoy hablando aquí el chico de la mongos si, que pasa están unos hombres",Unknown,Unknown,Distressed,0.0
C522,"Hi, what's your name? I'm Tom. And a little girl just went to the bathroom for a long time to enter.",Unknown,Unknown,Distressed,0.0
C523,And it's like I just tried to get out of this car. I got out of this car and he tried to get in my truck.,Accident,Unknown,Distressed,0.0
C524,"Somebody has been shot. They're calling to please and an ambulance. Yes, does he want the horseshoe? Yes, what?",Assault,Unknown,Distressed,0.6
C525,I'm just having older women standing here and she had noticed two gentlemen trying to get in a house.,Unknown,Unknown,Concerned,0.0
C526,"Easy. Easy now, my sister.<|bs|>.",Unknown,Unknown,Concerned,0.3
C527,I have been in the news recently about being on in a hotel naked.,Disturbance,Unknown,Distressed,0.0
C528,There's an armed robbery going right on right now. I've been shot in the back and I'm bleeding. You've been shot in the back? Yes. OK.,Theft,Unknown,Distressed,1.0
C529,"And yes, my friends have to have me. He doesn't have to. He'll have to.",Unknown,Unknown,Calm,0.0
C530,absolute,Unknown,Unknown,Calm,0.0
C531,"emergency, my girlfriend just jumped off the back of our hotel room.",Unknown,Unknown,Distressed,0.3
C532,"Yes, other guys been shot. Okay, right here on Burdenon Avenue. I want to see if the M1",Assault,Burdenon Avenue,Distressed,0.35
C533,"No, there's people trying to break in my house. Okay, they're there right now. They're here right now. They just spoke a basement window.",Unknown,Unknown,Distressed,0.3
C534,"Alright, I killed my girlfriend. Excuse me? Did you hear me? I want you to re-",Assault,Unknown,Distressed,0.3
C535,three black men in the middle of Russell Boulevard and one of them has like a,Unknown,Unknown,Calm,0.0
C536,"it was a bus. Let me see. Okay, I'm right. Yeah. It's wrapped by one...",Unknown,Unknown,Calm,0.0
C537,"And with the already got somebody on the way, can you give me any kind of description? It's too black guys.",Unknown,Unknown,Distressed,0.0
C538,There are three black gentlemen that are there harassing the women out there.,Disturbance,Unknown,Distressed,0.0
C539,"I was at a McDonald's, I paid $10 and these guys gave me one burger and a five.",Unknown,Unknown,Distressed,0.0
C540,I gave you guys $10 they gave me one burger and a fry and told me to fuck.,Unknown,Unknown,Distressed,0.0
C541,I've been run over. I've been run over. They all use real chat for...,Unknown,Unknown,Distressed,0.0
C542,"Yes, my husband is a black man, I stabbed him. Okay, what's your address? 94 95 Stabber.",Assault,Unknown,Distressed,0.3
C543,I'm driving and I have somebody chasing me and they just hit my car.,Accident,Unknown,Distressed,0.0
C544,"I'm gonna go to my son, he's here. He's here. I think he's drunk. I don't know if he has to go to my police.",Disturbance,Unknown,Distressed,0.5
C545,"Well, I'm the arm drum now, I'm just trying to figure out the thing when you hit.",Accident,Unknown,Distressed,0.3
C546,Why do I think we have to make this shit worth a matter? I'm at the court.,Accident,Unknown,Distressed,0.0
C547,I have a concern for a co-worker. She just called me and sounded very...,Unknown,Unknown,Distressed,0.1
C548,"I just think, he's called family, he's dead. He's trying to hysterical, I can't understand. I'm having a ton of over this.",Unknown,Unknown,Distressed,0.3
C549,"That being fired in so many things, how? So I'm finshada. Yeah, you can slide there over.",Fire,Unknown,Distressed,0.3
C550,Someone is getting my house. It was an issue.,Unknown,Unknown,Distressed,0.1
C551,I just saw a guy go into a room.,Unknown,Unknown,Distressed,0.0
C552,I'm sorry.,Unknown,Unknown,Distressed,0.0
C553,"Just been shot in front of my parents. You've been shot? Yes, right. Where have you been shot at? To the end of my leg.",Assault,Unknown,Distressed,0.3
C554,"Yes, the guy is following us with shotgun and he's trying to run us off the road. There you are. We're standing...",Assault,Unknown,Distressed,0.6
C555,"Somebody just broke into our house. With the address, Kevin, to me. With the address, I shot him. You shot him?",Theft,Unknown,Distressed,0.5
C556,"I just got my daughters and my children. You just did a lot of it? Got my daughters? Yes, got them.",Unknown,Unknown,Calm,0.0
C557,Which two people in the house? Do they have weapons? Huh? Yes. What type of...,Assault,Unknown,Distressed,0.3
C558,"Hi, my name is Stephen Rodwald and I just heard a shoot my dad.",Unknown,Unknown,Calm,0.0
C559,The baby was fully seeing the mother I had.,Unknown,Unknown,Calm,0.0
C560,My name is Stacy and I'm driving towards Ontario and a car went off into me at my marker 22,Accident,Ontario,Calm,0.0
C561,I just can't get him sex with a window. Is anybody hurting your house? I don't know yet.,Unknown,Unknown,Distressed,0.3
C562,Two people are breathing towards no call. Yes.,Unknown,Unknown,Calm,0.0
C563,"What's going on? I don't know. Somebody broke the window I know. And your house or your car? Ah, smart.",Accident,Unknown,Calm,0.5
C564,"there are two men who was going to try to kill me. They have my husband on the floor. He's bleeding. All right, what is he?",Medical,Unknown,Distressed,0.3
C565,"Hey, the sprawler has taken a very good death trail. Yeah, people enjoy it. So, so, so.",Unknown,Unknown,Calm,0.0
C566,"and there were some kids over there, just one other kid, little fire and another kid in. Oh God.",Fire,Unknown,Distressed,0.3
C567,The little boy just called on fire and he jumped off the other swimming car. What's the address?,Fire,Unknown,Distressed,0.3
C568,I cut my wife so sweet in the bathtub and I think she's dead. I want you with the anger.,Unknown,Unknown,Distressed,0.3
C569,"right now. She just gone and I need him out. Is this house? Okay, what do you mean, she would be in the end?",Unknown,Unknown,Distressed,0.3
C570,I just killed my boss. You just did what?,Assault,Unknown,Distressed,0.3
C571,"Yeah, I have a black guy in here. He says he's gonna wrap the store and anyone is supposed to give him He says he has a gun on him",Assault,Unknown,Distressed,0.3
C572,Hello. I need to raise up to you. Please come on in.,Unknown,Unknown,Calm,0.3
C573,"Please. Give me the address first, ma'am. Ma'am?",Unknown,Unknown,Distressed,0.3
C574,I have so many people are shooting and people are running out of my building at work.,Assault,Unknown,Distressed,0.3
C575,"Yes, ma'am, I'm having a shot. BEEP BEEP",Assault,Unknown,Distressed,0.4
C576,"uca 보세요, anyona",Unknown,Unknown,Distressed,0.0
C577,I'm bringing the key to the master right now. I work at 3 Bay and a couple of the ladies that work there just ran down here.,Unknown,Unknown,Distressed,0.3
C578,We were closing the store and the guy came in with a mask on and I think...,Unknown,Unknown,Distressed,0.0
C579,"I'm not sorry, my neighbor came. And now she said her husband said, the baby, I'll fire. I don't know, the lady.",Fire,Unknown,Distressed,0.6
C580,He will just throw in my neighbor's house. Just the address. What's the address?,Unknown,Unknown,Distressed,0.0
C581,I think I got shot. Danny Sriper 4203 Lake Avenue with Fumbi.,Assault,"Fumbi, Lake Avenue",Distressed,0.3
C582,the black kana run,Unknown,Unknown,Distressed,0.0
C583,"Your mommy's sick. If your mommy's sick, does she need an ambulance? Mommy.",Medical,Unknown,Distressed,0.0
C584,I woke up this morning and my daughter was not in the house. I don't know if she walked out. I don't know.,Unknown,Unknown,Distressed,0.3
C585,What's going on man?,Unknown,Unknown,Distressed,0.0
C586,I just killed my daughter. You what? I just killed my daughter.,Assault,Unknown,Distressed,0.3
C587,"I'm a literacy expert. Man, man, man, man, man, man, calm down.",Unknown,Unknown,Calm,0.0
C588,I need to unambient quickly and out of fire fire in commission,Fire,Unknown,Distressed,0.6
C589,The house is on fire. The house is blowing up. Can you guys can listen? We've already got a call. Is it on a line?,Fire,Unknown,Distressed,0.3
C590,There's a man at my back door he's trying to get in.,Unknown,Unknown,Distressed,0.0
C591,Давай than,Unknown,Unknown,Concerned,0.0
C592,His friends are his friends because it's one of the things I don't know.,Unknown,Unknown,Calm,0.3
C593,"left heading south on 9.51. Yeah, it's a fairly new model truck. Looks like a Dodger afford.",Unknown,Unknown,Calm,0.0
C594,"We've found an elephant walking down the street near the community center, the rate 20.",Unknown,Unknown,Distressed,0.0
C595,"Oh, I was coming to pass out. Is there anything else? I was coming to pass out.",Unknown,Unknown,Distressed,0.0
C596,I think I know why you could follow me home because somebody thinks it feels a big I can't drive home straight.,Unknown,Unknown,Distressed,0.3
C597,"radio I haven't been in the lobby with the gun. All right, is everybody okay? Everybody away from home? Oh, yeah.",Assault,Unknown,Calm,0.3
C598,"Can we meet police assistance for this? Okay, what's going on?",Unknown,Unknown,Distressed,0.0
C599,My mom and her boyfriend and her boyfriend felt marijuana.,Unknown,Unknown,Distressed,0.0
C600,"I accidentally shot my husband. You accidentally shot your husband? Yes. OK, is he breathing?",Accident,Unknown,Distressed,0.55
C602,"Uh, these came up to visit all of the home fathers. Uh-huh. And I think they were lovely to see them.",Unknown,Unknown,Calm,0.0
C603,I'm going to cost him a gunpoint and the 3400 block to highway drive southeast.,Assault,Unknown,Distressed,0.3
C604,I need to tell a few minutes to start shooting. I don't know where I'm at. One winter is dropping. The birds are falling.,Assault,Unknown,Distressed,0.6
C605,We got a baby that's not responsible. We're at 3301 West Noelle Drive.,Unknown,Unknown,Distressed,0.0
C606,I'm going to return air cream. Just went down off of Encona. And airplane.,Accident,Encona,Distressed,0.0
C607,"I'm not in any danger right now, but it's all my urgent. These people, they came through my door.",Unknown,Unknown,Calm,0.3
C608,I might just call it the potential robbery and my mother's been missing for... I don't know.,Theft,Unknown,Distressed,0.8
C609,"Yeah my, my dad did that shot back bad times day Okay, wait",Assault,Unknown,Distressed,0.3
C610,"I went off the road, I'm in a retention pond right now. You're in the retention pond? Yeah. Okay.",Unknown,Unknown,Distressed,0.3
C611,your emergency? I've got a gentleman in quarantine with a gun. I need someone here right now. I'm the storm manager.,Assault,Unknown,Distressed,1.0
C612,I need a phyllo-prove laser for a computer officer to my house.,Unknown,Unknown,Distressed,0.0
C613,is going to take please help into a by turn. Can you吸 content?,Unknown,Unknown,Distressed,0.6
C614,She's shooting at her! Come to the fucking house! That's not the way!,Assault,Unknown,Distressed,0.45
C615,"I just killed my kids. What's your name, male? Julia Murray. What is it?",Assault,Unknown,Distressed,0.3
C616,"I'm not going to try to jump the other way, I'm going to go. And I'm trying to act like I can't hear you.",Unknown,Unknown,Distressed,0.0
C617,the building on 334 south of 8 quarters on fire. Report of a house fire house fire.,Fire,Unknown,Distressed,0.4
C618,"there's a house on fire. There's a house on fire. 30, 30, 30, 38.",Fire,Unknown,Distressed,0.3
C619,"I think there's been a murder. Okay, and where is the person at? Is the victim?",Assault,Unknown,Distressed,0.3
C620,I know a lot But look and the clemen I know Whoo,Unknown,Unknown,Calm,0.3
C621,There's a fight broke out in the liquor store. There's a customer holding him back. You guys need to...,Assault,Unknown,Distressed,0.4
C622,"ey, but work.",Unknown,Unknown,Calm,0.0
C623,I've got a black man here who's supposed to come out of house. Repanded.,Unknown,Unknown,Distressed,0.0
C624,We have a trainer in the water with one of our whales. The whale that's set up to be in the water with? Okay.,Unknown,Unknown,Calm,0.0
C625,"There's some car, there's some guy, there's gonna be a way more than that. Can you close?",Accident,Unknown,Calm,0.0
C626,"I think the house will fire. Okay, with me, and we are is it? One, two, two, one, eight.",Fire,Unknown,Distressed,0.3
C627,"Yes, you're big. You just wanted to go back. I don't know where you are.",Unknown,Unknown,Calm,0.3
C628,"Yeah, I just killed somebody. You what? I just killed somebody. You killed somebody? Yeah.",Assault,Unknown,Distressed,0.3
C629,"shot, which had fired on Russian",Fire,Russian,Distressed,0.6
C630,"Orn Cavenday, there's somebody shot somebody in the store. Okay, orn Cavenday, where?",Assault,Unknown,Distressed,0.3
C631,the media leaders that died with a knife for me. Brown token. Don't threaten me.,Assault,Unknown,Concerned,0.3
C632,"Okay, is that a single family home or an apartment man?",Unknown,Unknown,Distressed,0.0
C633,"My point goes shot. Alright, Santa, I want to come in with you. Are you over there, Lesky?",Assault,Santa,Distressed,0.3
C634,瓜董风locked they are,Unknown,Unknown,Distressed,0.0
C635,I don't have money to buy a ticket. I don't have money.,Unknown,Unknown,Distressed,0.0
C636,or there's none. This is my one one. Do you need police or medical...,Medical,Unknown,Distressed,0.0
C637,"Yes, they are killing so we have pardoned.",Unknown,Unknown,Distressed,0.0
C638,"Hey, I got her, I got an audio. Seminole with the transistor. Okay, pull it. Okay, I'm in the middle.",Unknown,Unknown,Concerned,0.0
C639,"I'm not a mom or a guy shot. What? I'm not a man, I'm not a guy shot. Bye, who?",Assault,Unknown,Distressed,0.3
C640,There's been an explosion on I 30 on I'm sorry 183 research. I'm gonna test you. I'm at,Fire,Unknown,Distressed,0.0
C641,"Okay, what kind of plane was it? How big was it, sir? It looked like a desna, like a prop plane.",Accident,Unknown,Distressed,0.0
C642,"No, it's worth everything I'm getting ready to kill somebody. No, it's worth where? Everton. Everton?",Unknown,Unknown,Distressed,0.0
C643,"Inней Guethwaying with a Bhaktor Bogyakal, we'll be straight by successive",Unknown,Unknown,Distressed,0.0
C644,I just saw my best friend on the X-E-Santz. Oh my god! I just shot your best friend. How did- where did-,Assault,Unknown,Distressed,0.35
C645,"And it's what I already saw with me. Okay, how cool. Hey, buddy. Hey, buddy.",Unknown,Unknown,Calm,0.0
C646,"My dad told me my duck. Her, her dad.",Unknown,Unknown,Distressed,0.0
C647,I went out broke. I hope she was not back and I was getting her in. Should have been like-,Unknown,Unknown,Distressed,0.2
C648,"Hey, guys, I just saw a Godfly, two shots after a...",Assault,Godfly,Distressed,0.3
C649,I can't see anything. I was struck with a bottle. And I'm a freak.,Unknown,Unknown,Distressed,0.0
C650,I have to unfortunately keep you up for more words can I judge this? Curtis says what I do wrong lol,Unknown,Unknown,Distressed,0.0
C651,We had someone come in and asked for dial 911 that there's a woman yelling.,Disturbance,Unknown,Distressed,0.1
C652,"Okay, it's a mind. Ma'am? Yes. What's the emergency? I...",Unknown,Unknown,Calm,0.35
C653,There's someone at my door and he keeps on knocking on the door and he tried opening it.,Unknown,Unknown,Distressed,0.1
C654,I just killed my children. Excuse me? I just killed my children. Where are you?,Assault,Unknown,Distressed,0.3
C655,I have ordered food which is totally ridiculous you can get.,Unknown,Unknown,Distressed,0.0
C656,It sounded like gunshot behind the door. We were in the door at the title store.,Assault,Unknown,Distressed,0.6
C657,This is an emergency. My car is in the litter right off the street. Mullins car.,Accident,Unknown,Distressed,0.3
C658,I make sure to report gun shot wound. Someone gun shot wound.,Assault,Unknown,Distressed,0.8
C659,"Okay, I got her a female shot 17831, someone had a new apartment and...",Assault,Unknown,Distressed,0.4
C660,I just came home in my girlfriend and my mother somebody worked at the moment where I had a simple ad-,Unknown,Unknown,Distressed,0.0
C661,When a water broke never branching back to the handmade. You know it doesn't work.,Unknown,Unknown,Distressed,0.5
C662,my brother killed my brother. I heard this street name but you're going outside in somewhere a second.,Assault,Unknown,Distressed,0.3
C663,"There's a guy laying on the road he's leaving. OK, man, I'm going to even hit by a car. I'm going to get started. I don't know.",Accident,Unknown,Distressed,0.35
C664,I can't find my son. Calm down. What is your address?,Unknown,Unknown,Distressed,0.0
C665,I killed my boat kids. I'm sorry? I killed my boat kids. They are dying. I...,Assault,Unknown,Distressed,0.65
